<?xml version="1.0" encoding="utf-8" ?>
<tool xmlns:xsi="http://www.w3.org/2001/XMLSchema-instance"
	xsi:schemaLocation="http://scape-project.eu/tool toolwrapper-data/src/main/resources/tool-1.1_draft.xsd"
	xmlns="http://scape-project.eu/tool" xmlns:xlink="http://www.w3.org/1999/xlink"
	schemaVersion="1.1" name="ImageMagick" version="2.0.0"
	homepage="http://www.imagemagick.org/script/convert.php">
	<installation>
		<operatingSystem operatingSystemName="Debian">
			<packageManager type="Maven">
				<config>
						&lt;dependency&gt;
							&lt;groupId&gt;pt.gov.dgarq.roda&lt;/groupId&gt;     
							&lt;artifactId&gt;roda-common-utils&lt;/artifactId&gt;
							&lt;version&gt;1.0.0&lt;/version&gt;                 
						&lt;/dependency&gt;
						&lt;dependency&gt;
							&lt;groupId&gt;pt.gov.dgarq.roda&lt;/groupId&gt;     
							&lt;artifactId&gt;roda-common-data&lt;/artifactId&gt;
							&lt;version&gt;1.0.0&lt;/version&gt;                 
						&lt;/dependency&gt;
				</config>
				<source>http://artifactory.keep.pt/keep</source>
			</packageManager>
			<packageManager type="Dpkg">
				<config>imagemagick</config>
				<source>deb http://scape.keep.pt/apt stable main</source>
			</packageManager>
			<dependency name="imagemagick">
				<license name="Apache-2.0" type="FLOSS"
					uri="http://opensource.org/licenses/Apache-2.0" />
			</dependency>
		</operatingSystem>
		<operatingSystem operatingSystemName="Ubuntu">
			<packageManager type="Dpkg">
				<config>imagemagick</config>
				<source>deb http://scape.keep.pt/apt stable main</source>
			</packageManager>
			<dependency name="imagemagick">
				<license name="Apache-2.0" type="FLOSS"
					uri="http://opensource.org/licenses/Apache-2.0" />
			</dependency>
		</operatingSystem>
		<license name="Apache-2.0" type="FLOSS"
			uri="http://opensource.org/licenses/Apache-2.0" />
	</installation>

	<operations>
		<operation
			name="digital-preservation-migration-image-imagemagick-image2tiff">
			<description>Converts any ImageMagick supported image format to TIFF</description>
			<command>/usr/bin/convert ${params} ${input} tiff:${output}</command>
			<inputs>
				<input name="input" required="true">
					<description>Reference to input file</description>
				</input>
				<parameter name="params" required="false">
					<description>Additional input conversion parameters</description>
					<possibleValue description="no compression">-compress None</possibleValue>
					<possibleValue description="run length encoding">-compress RLE</possibleValue>
				</parameter>
			</inputs>
			<outputs>
				<output name="output" required="true">
					<description>Reference to output file</description>
					<extension>tiff</extension>
				</output>
			</outputs>
		</operation>
	</operations>
</tool>
