<?xml version="1.0" encoding="utf-8"?>
<tool xmlns:xsi="http://www.w3.org/2001/XMLSchema-instance" xmlns="http://scape-project.eu/tool" xmlns:xlink="http://www.w3.org/1999/xlink" xsi:schemaLocation="http://scape-project.eu/tool toolwrapper-data/src/main/resources/tool-1.1_draft.xsd" schemaVersion="1.1" name="ImageMagick" version="2.0.0" homepage="http://www.imagemagick.org/script/convert.php">
	<license name="Apache-2.0" type="FLOSS" uri="http://opensource.org/licenses/Apache-2.0"/>
	<installation>
		<operatingSystem operatingSystemName="Debian">
			<packageManager type="Dpkg">
				<config>imagemagick</config>
				<source>deb http://scape.keep.pt/apt stable main</source>
			</packageManager>
			<dependency name="imagemagick">
				<license name="Apache-2.0" type="FLOSS" uri="http://opensource.org/licenses/Apache-2.0"/>
			</dependency>
		</operatingSystem>
		<operatingSystem operatingSystemName="Ubuntu">
			<packageManager type="Dpkg">
				<config>imagemagick</config>
				<source>deb http://scape.keep.pt/apt stable main</source>
			</packageManager>
			<dependency name="imagemagick">
				<license name="Apache-2.0" type="FLOSS" uri="http://opensource.org/licenses/Apache-2.0"/>
			</dependency>
		</operatingSystem>
	</installation>
	<operations>
		<operation name="digital-preservation-migration-image-imagemagick-image2txt">
			<description>Converts any ImageMagick supported image format to Text</description>
			<command>/usr/bin/convert ${input} txt:${output}</command>
			<inputs>
				<input name="input" required="true">
					<description>Reference to input file</description>
				</input>
				<parameter name="params" required="false">
					<description>Additional conversion parameters</description>
				</parameter>
			</inputs>
			<outputs>
				<output name="output" required="true">
					<description>Reference to output file</description>
					<extension>txt</extension>
				</output>
			</outputs>
		</operation>
	</operations>
</tool>
